ID,Autor,URL,Puntuación,Cantidad de Comentarios,Creado,Texto Original,Texto Traducido
gaqe3d,Sponta7,https://i.redd.it/04iw5fezewv41.png,3541,274,1588227780.0,Made an annoying Python script that sends a friend on Facebook Messenger the Shrek movie word by word,Hizo un molesto guión de Python que envía a un amigo a Facebook Messenger The Shrek Movie Word by Word
fqdnjv,sameera__madushan_,https://i.redd.it/suixxhhwgcp41.gif,1453,103,1585371209.0,I made a python script to download and save your favorite Facebook videos.,Hice un guión de Python para descargar y guardar sus videos favoritos de Facebook.
176yc59,pknerd,https://blog.adnansiddiqi.me/automate-your-recipe-posts-on-facebook-page-with-python/?utm_source=r_python_fb_post&utm_medium=reddit&utm_campaign=c_r_python_fb_post,0,0,1697202421.0,Automate Your Recipe Posts on Facebook Page with Python,Automatice sus publicaciones de recetas en la página de Facebook con Python
10k4cmm,Equal_Astronaut_5696,https://youtu.be/jyj8gCt1Qn0,0,1,1674563317.0,Forecasting with Facebook's Prophet Model,Pronóstico con el modelo de Profeta de Facebook
4ztmnm,rodrigc,https://www.youtube.com/watch?v=nRtp9NgtXiA,174,49,1472292050.0,Python 3 at Facebook,Python 3 en Facebook
bylqx8,pvkooten,https://www.reddit.com/r/Python/comments/bylqx8/tricked_my_wife_into_talking_to_a_deep_neural_bot/,507,57,1560096304.0,Tricked my wife into talking to a deep neural bot trained on 7 years of messages on Facebook,Engañó a mi esposa para que hablara con un bot neural profundo entrenado en 7 años de mensajes en Facebook
13pnby5,Terrible_Zone_8889,https://www.reddit.com/r/Python/comments/13pnby5/introducing_a_free_facebook_scraping_library/,1,2,1684845525.0,Introducing a Free Facebook Scraping Library - Unlimited Calls and Future Optimizations!,Presentación de una biblioteca gratuita de raspado de Facebook: llamadas ilimitadas y optimizaciones futuras!
n83vvj,RichKatz,https://devclass.com/2021/05/06/python-programmers-prepare-for-pumped-up-performance/,485,115,1620525458.0,"Python programmers prepare for pumped-up performance: Article describes Pyston and plans to upstream Pyston changes back into CPython, plus Facebook's Cinder: ""publicly available for anyone to download and try and suggest improvements.""","Los programadores de Python se preparan para el rendimiento bombeado: el artículo describe a Pyston y planea ascender los cambios de Pyston en CPYTHON, además de la ceniza de Facebook: ""disponible públicamente para que cualquiera descargue e intente sugerir mejoras""."
10wbc37,lorenzo_1999,https://www.reddit.com/r/Python/comments/10wbc37/nikhil_garg_fennel_ai_exfacebook_exquora_teaches/,0,3,1675799717.0,"Nikhil Garg (Fennel AI, ex-Facebook, ex-Quora) Teaches Production-Grade Python","Nikhil Garg (Fennel AI, Ex-Facebook, Ex-Quora) enseña Python de grado de producción"
qjuyza,ShayonDebRoy,https://www.reddit.com/r/Python/comments/qjuyza/automating_birthday_wishes_on_facebook_using/,20,8,1635703248.0,Automating Birthday wishes on Facebook using Python,Automatizar deseos de cumpleaños en Facebook usando Python
396aau,dairypharmer,https://www.reddit.com/r/Python/comments/396aau/fb_eraser_automate_deleting_your_old_facebook/,117,49,1433864752.0,FB Eraser - Automate deleting your old Facebook posts,FB Eraser - Automatice la eliminación de sus viejas publicaciones de Facebook
5oqn6u,iamtrask,http://pytorch.org/,234,12,1484759970.0,Facebook open sources PyTorch,Fuentes abiertas de Facebook Pytorch
ts1al4,Abhi_mech007,https://www.zdnet.com/article/programming-languages-python-just-got-a-boost-from-facebooks-meta/,0,7,1648626768.0,Programming languages: Python just got a boost from Facebook's Meta,Lenguajes de programación: Python acaba de obtener un impulso de Meta de Facebook
hyc9zg,meanjan,https://www.reddit.com/r/Python/comments/hyc9zg/fviz_facebook_data_visualizer_understand_your/,7,0,1595789195.0,fviz - Facebook Data Visualizer : understand your Facebook activity,FVIZ - Visualizador de datos de Facebook: comprenda su actividad de Facebook
q7f29s,kharltayyab,https://www.reddit.com/r/Python/comments/q7f29s/a_strong_facebook_scraper_and_client/,17,0,1634143029.0,A Strong Facebook Scraper and Client,Un fuerte raspador y cliente de Facebook
iixbq,martey,http://bugs.developers.facebook.net/show_bug.cgi?id=17429,163,38,1310035033.0,Facebook is discontinuing support for its Python SDK,Facebook está suspendiendo el apoyo a su SDK de Python
ta80el,southcongresser,https://www.reddit.com/r/Python/comments/ta80el/cantera_chatbot_a_python_flame_calculator_on/,2,1,1646833259.0,"Cantera Chatbot, a Python flame calculator on Facebook Messenger","Cantera Chatbot, una calculadora de llama de Python en Facebook Messenger"
okn9r4,jamescalam,https://www.pinecone.io/learn/faiss-tutorial/,3,1,1626331552.0,Getting Started With Facebook AI's Faiss,Comenzando con Facebook AI's Faiss
hu4iu2,meanjan,https://www.reddit.com/r/Python/comments/hu4iu2/fviz_facebook_data_visualizer_cli_tool_for/,1,0,1595180607.0,"fviz - Facebook Data Visualizer, CLI tool for exploring deep into exported Facebook data","FVIZ - Facebook Data Visualizer, Tool CLI para explorar profundidad en los datos de Facebook exportados"
heg3uz,geramateos,https://www.reddit.com/r/Python/comments/heg3uz/hack_facebook_ai/,1,3,1592924307.0,Hack Facebook AI,Hack Facebook que tienes
89kjiu,lrobinson2011,https://www.leejamesrobinson.com/blog/analyzing-10-years-of-facebook-data/,150,13,1522802350.0,Python Script to Analyze 10+ Years of My Facebook Data,Python Script para analizar más de 10 años de mis datos de Facebook
gaqse5,oh_mayn_wait_a_min,https://www.reddit.com/r/Python/comments/gaqse5/facepy_for_facebook/,0,0,1588229822.0,facepy for Facebook,Facepy para Facebook
o8ai13,blackheartredeye,https://www.reddit.com/r/Python/comments/o8ai13/how_to_create_facebook_3d_image_using_python/,1,0,1624713021.0,How to Create Facebook 3D Image using PYTHON,Cómo crear una imagen 3D de Facebook usando Python
o8bct7,blackheartredeye,https://www.youtube.com/watch?v=PoiuMGoY3a8,0,0,1624716082.0,Depth Map with Python & upload on Facebook,Mapa de profundidad con python y cargar en Facebook
i5lv95,thedeats,https://www.reddit.com/r/Python/comments/i5lv95/really_cool_tools_by_facebook/,0,2,1596833504.0,Really cool tools by Facebook,Herramientas realmente geniales de Facebook
kltkb6,segghtegrs,https://youtu.be/W6jnJh1PcCA,0,0,1609172866.0,Facebook Using AI To Summarize News??,Facebook usando AI para resumir las noticias?
gfza6d,danish-shaikh,https://www.reddit.com/r/Python/comments/gfza6d/facebook_bot_budget_istimate/,0,1,1588964569.0,Facebook bot budget istimate,Presupuesto de Bot de Facebook istimate
lmtc5s,Abdoo_65,https://www.reddit.com/r/Python/comments/lmtc5s/i_created_a_self_aware_facebook_post_got_blocked/,2,5,1613672471.0,"I created a Self Aware Facebook Post, got blocked .","Creé una publicación de Facebook de sí mismo, me bloqueé."
ghuv4b,dereck255,https://www.reddit.com/r/Python/comments/ghuv4b/facebook_search_content_by_query/,1,1,1589226104.0,Facebook: Search Content by Query,Facebook: Búsqueda de contenido por consulta
iwb18b,blackheartredeye,https://pysnakeblog.blogspot.com/2020/08/download-facebook-private-videos-using.html,2,0,1600595225.0,Download facebook private videos using Python,Descargar videos privados de Facebook usando Python
jmbu1v,DrIroh,https://www.reddit.com/r/Python/comments/jmbu1v/facebook_messenger_best_way_to_scrape_messages/,2,3,1604270879.0,Facebook Messenger - Best way to scrape messages?,Facebook Messenger - ¿La mejor manera de raspar los mensajes?
dlou47,edugomez28,https://www.reddit.com/r/Python/comments/dlou47/facebook_marketing_api/,0,0,1571779826.0,Facebook Marketing API,API de marketing de Facebook
i6w0z7,bauripalash,https://pyre-check.org/,35,8,1597024841.0,Pyre : A performant type-checker for Python 3 developed by Facebook,Pyre: un comprobador de tipo de actuación para Python 3 desarrollado por Facebook
chkcoc,subhamroy021,https://www.codeingschool.com/2019/07/facebook-login-using-python.html,2,2,1564038583.0,Facebook Login using Python,Iniciar sesión en Facebook usando Python
8xrpi9,hawk6242,https://www.reddit.com/r/Python/comments/8xrpi9/automated_facebook_searching/,1,4,1531245684.0,Automated Facebook Searching,Facebook automatizado Búsqueda
2s4m0e,mrlebo,http://nodotcom.org/python-facebook-tutorial.html,12,5,1421033222.0,Python Facebook tutorial - post to Facebook in 4 steps,Tutorial de Facebook de Python - Publicar en Facebook en 4 pasos
m656oi,cheerfulboy,https://ayushirawat.com/automate-any-chat-messenger-with-python,49,2,1615887240.0,"Easily automate Whatsapp, Facebook, and Instagram Chat-Messenger with Python using PyAutoGUI","Automatizar fácilmente WhatsApp, Facebook e Instagram Chat-Messenger con Python usando Pyautogui"
ier454,ai-lover,https://www.marktechpost.com/2020/08/22/pysa-an-open-source-python-static-analyzer-by-facebook/,4,2,1598132682.0,Pysa: An Open-Source Python Static Analyzer by Facebook,PYSA: Un analizador estático de Python de código abierto de Facebook
dyy9si,redwhiteredeh,https://www.reddit.com/r/Python/comments/dyy9si/building_a_facebook_marketing_dashboard_with/,1,3,1574232512.0,Building a Facebook Marketing Dashboard With Python,Construyendo un tablero de marketing de Facebook con Python
hjj6a5,luyer74,https://www.reddit.com/r/Python/comments/hjj6a5/is_there_something_like_tweepy_but_for_facebook/,0,1,1593637828.0,Is there something like Tweepy but for Facebook?,¿Hay algo como Tweepy pero para Facebook?
bkuvjv,zephyr_33,https://www.reddit.com/r/Python/comments/bkuvjv/creating_a_bot_that_can_clean_facebook/,1,6,1557039589.0,Creating a bot that can clean Facebook?,¿Crear un bot que pueda limpiar Facebook?
bomkn0,YodaCodar,https://www.reddit.com/r/Python/comments/bomkn0/new_miami_python_facebook_group/,2,2,1557858296.0,New Miami Python Facebook Group,Nuevo grupo de Facebook de Miami Python
smne18,AmicusRecruitment,https://www.reddit.com/r/Python/comments/smne18/graph_neural_networks_live_webinar_q_a_with/,2,0,1644231023.0,GRAPH NEURAL NETWORKS: Live Webinar + Q & A with Facebook Engineering Lead/AI Leader Rahul Agrawal,Redes neuronales Graph: Seminario web en vivo + Preguntas y respuestas con el líder de Facebook Ingeniería/Líder de AI Rahul Agrawal
q4rh39,Nailer_Owl,https://www.reddit.com/r/Python/comments/q4rh39/wrote_a_blog_on_suckerbug_a_python_script_to/,33,0,1633805516.0,Wrote a blog on - Suckerbug: A python script to scrape photos from facebook's public pages,Escribió un blog sobre - Suckerbug: un guión de Python para raspar fotos de las páginas públicas de Facebook
ar16sl,OddBed,https://www.reddit.com/r/Python/comments/ar16sl/web_scrap_a_facebook_post/,0,3,1550264318.0,Web scrap a facebook post?,Web Scrapes una publicación de Facebook?
a0xkzm,freakH2O,https://www.reddit.com/r/Python/comments/a0xkzm/forex_auto_poster_to_facebook/,0,4,1543343509.0,Forex Auto Poster to facebook,Póster de Forex Auto a Facebook
j4f5hg,tm9hbqn,https://www.reddit.com/r/Python/comments/j4f5hg/information_filtering_project_on_facebook_groups/,1,0,1601732329.0,Information filtering project on Facebook groups using Graph API,Proyecto de filtrado de información en grupos de Facebook utilizando API de gráficos
kl7ce8,oksana-b,https://www.reddit.com/r/Python/comments/kl7ce8/python_programmer_girl_community/,0,0,1609089644.0,Python programmer girl community: https://www.facebook.com/oksana.barshchyk/,Python Programmer Girl Community: https://www.facebook.com/oksana.barshchyk/
9j9bq,ch0wn,http://developers.facebook.com/news.php?blog=1&amp;story=301,127,16,1252604576.0,Tornado: Facebook's Real-Time Web Framework for Python,Tornado: el marco web en tiempo real de Facebook para Python
mqz881,harshit_roy_python,https://youtu.be/IAmGMpi5oJQ,0,1,1618431936.0,I create this Tkinter Gui which looks similar to the Facebook Login page,Creo esta GUI tkinter que se parece a la página de inicio de sesión de Facebook
